Instance,News Type / Sector,Proxy Event,Initial Media Release Date,Market Impact (Dips/Rises),Data Source/Analysis
1,War/Conflicts / Defense,Russia-Ukraine Invasion,"February 24, 2022","Global defense stocks positively impacted (81.4%); Indian defense index volatile, e.g., falls 2.5% on peace talks implying rises on escalation; HAL potentially +5-8% from budget hikes analogy.",", , ; Analysis: Wars boost defense via budgets; initial market dip but sector gains long-term (e.g., abnormal returns positive)."
2,War/Conflicts / Commodities,Russia-Ukraine Invasion,"February 24, 2022","Commodity prices rose 20-50% (e.g., wheat +40%, oil spikes); Nifty Commodities negative on war day; overall volatility with 3% market fall.",", , ; Analysis: Supply disruptions hiked prices, but stocks dipped initially due to uncertainty (e.g., -ve returns for commodities sector)."
3,Trade Relations / Commodities,India-Australia ECTA FTA,"December 29, 2022 (entry into force; signed April 2, 2022)","Exports grew 135% (2019-2021 baseline); agri shipments +38.4% (rice), +29% (spices); Nifty Commodities positive from duty cuts (e.g., 20-30% export potential).",", , ; Analysis: Tariff reductions boosted exports, leading to stock gains (e.g., 14% export growth post-FTA)."
4,Trade Relations / Technology,India-Australia ECTA FTA,"December 29, 2022",IT exports gained access; eliminated double taxation saving billions; Nifty IT up 2-4% analogy from deals; electronics +128% shipments.,", ; Analysis: Enhanced market access and tax relief competitive edge, positive stock reaction (e.g., 22.1% pharma/tech overlap)."
5,Budget Reforms / Energy,Union Budget 2024,"February 1, 2024",Nifty Energy up 3.16% post-budget; allocations for renewables boosted solar firms +5-10%; overall market dip 0.13% but sector gains.,", , ; Analysis: Focus on energy transition (e.g., solar push) drove spikes; volatility but net positive (37% allocation increase)."
6,Budget Reforms / Transportation,Union Budget 2024,"February 1, 2024","Shipping stocks up 3-5% (e.g., SCI +9.07%); rail stocks +1-3%; Nifty Infrastructure volatile but positive from infra allocations.",", ; Analysis: Waterways/ports push (48% increase) reduced costs 5-10%, boosting efficiency and stocks."
7,Regulatory Changes / Energy,Net Zero Pledge at COP26,"November 1, 2021",Nifty Energy growth from transition focus (81% solar capacity rise post-pledge); allocations up 37%; positive for renewables but initial volatility.,"; Analysis: Long-term net zero by 2070 signaled investments, leading to sector gains (e.g., +14% installed capacity)."
8,Regulatory Changes / Shipping,Sagarmala Programme Launch,March 2015 (cabinet approval; updates 2022),"Shipping traffic +118%; SCI gains from port modernization; coastal cargo +700%; stocks positive (e.g., 9-15% efficiency boosts).",", , ; Analysis: Infra investments (₹5.79 lakh crore) enhanced connectivity, driving stock rises (e.g., 262 projects completed)."